{
  "skill": "scalability",
  "eval_name": "generate-mode",
  "description": "Verify generate mode produces scalable code meeting all 10 categories",
  "tests": [
    {
      "id": "scale-gen-1",
      "name": "Generate optimized data list page",
      "prompt": "generate optimized problems list page with infinite scroll",
      "setup": "Next.js 16 with Prisma, Recharts, server components",
      "input_files": ["src/app/(app)/problems/page.tsx", "src/components/problems/problem-list.tsx"],
      "expectations": ["Dynamic import for Recharts", "Server component for data", "Pagination", "next/image for avatars", "No barrel imports"],
      "pass_criteria": "All 10 scalability categories addressed",
      "fail_indicators": ["No dynamic imports", "Client-side data fetch", "No pagination", "Barrel imports"]
    }
  ]
}
