{
  "skill": "caching",
  "eval_name": "eval-fix-workflow",
  "description": "Verify the caching-fix skill correctly parses scoring output, prioritizes, fixes, and re-scores.",
  "tests": [
    {
      "id": "accept-scoring-input",
      "name": "Accept Scoring Input",
      "prompt": "Run caching-fix with the scorecard as input",
      "setup": "Provide a caching-scoring scorecard with 5 issues across Cache-Control Headers, Static/Dynamic, Request Dedup.",
      "input_files": ["references/fix/implementation-workflow.md", "references/fix/verification.md"],
      "expectations": [
        "Run caching-fix with the scorecard as input",
        "Verify skill parses all 5 issues with correct severity and category",
        "Verify skill identifies the weighted score and grade"
      ],
      "pass_criteria": "All issues extracted. No issue lost or duplicated.",
      "fail_indicators": []
    },
    {
      "id": "fix-in-severity-order",
      "name": "Fix in Severity Order",
      "prompt": "Run caching-fix and observe fix application order",
      "setup": "Scorecard contains CRITICAL (authenticated data cached publicly), HIGH (no revalidation after mutations), MEDIUM (no cache() dedup).",
      "input_files": ["references/fix/implementation-workflow.md", "references/fix/verification.md"],
      "expectations": [
        "Run caching-fix",
        "Observe fix application order"
      ],
      "pass_criteria": "Public cache leak fixed first (CRITICAL), then revalidation (HIGH, 15% weight), then cache() dedup (MEDIUM). No MEDIUM fix applied before all HIGH items resolved.",
      "fail_indicators": []
    },
    {
      "id": "fix-references-correct-pattern",
      "name": "Fix References Correct Pattern",
      "prompt": "Run caching-fix and check which reference file the skill loads",
      "setup": "Issue in \"Cache-Control Headers\" category scored 3/10.",
      "input_files": ["references/fix/implementation-workflow.md", "references/fix/verification.md"],
      "expectations": [
        "Run caching-fix",
        "Check which reference file the skill loads"
      ],
      "pass_criteria": "Skill loads `references/fix-patterns/headers-revalidation.md` and applies the \"NO_CACHE_HEADERS\" pattern. Fix adds `Cache-Control: private, no-store` to authenticated API responses.",
      "fail_indicators": []
    },
    {
      "id": "verification-step-confirms-fix",
      "name": "Verification Step Confirms Fix",
      "prompt": "Run caching-fix to apply the Static Page Conversion fix and verify build output",
      "setup": "Apply the \"Static Page Conversion\" fix from `static-dynamic-isr.md`.",
      "input_files": ["references/fix/implementation-workflow.md", "references/fix/verification.md"],
      "expectations": [
        "Run caching-fix to apply the fix",
        "Check that skill verifies: `pnpm build` output shows correct static/dynamic classification"
      ],
      "pass_criteria": "Skill checks build output for static indicator on the converted page. Reports verification result before moving to next fix.",
      "fail_indicators": []
    },
    {
      "id": "re-score-shows-improvement",
      "name": "Re-Score Shows Improvement",
      "prompt": "Run caching-fix through full cycle and compare before/after scores",
      "setup": "Initial score 55/100 (grade C). Apply fixes for 1 CRITICAL + 3 HIGH issues.",
      "input_files": ["references/fix/implementation-workflow.md", "references/fix/verification.md"],
      "expectations": [
        "Run caching-fix through full cycle",
        "Compare before/after scores per category"
      ],
      "pass_criteria": "Re-score produces a higher weighted score. Each fixed category shows improvement. Final grade is at least B. Report uses `assets/templates/fix-report.md.template` format.",
      "fail_indicators": []
    }
  ]
}
