{
  "skill": "auth-fix",
  "eval_name": "eval-fix-workflow",
  "description": "Verify the auth-fix skill correctly parses scoring output, prioritizes, fixes, and re-scores.",
  "tests": [
    {
      "id": "accept-scoring-input",
      "name": "Accept Scoring Input",
      "prompt": "Run auth-fix with the scorecard as input",
      "setup": "Provide an auth-scoring scorecard with 7 issues across Session Management, CSRF, Rate Limiting.",
      "input_files": [],
      "expectations": [
        "Run auth-fix with the scorecard as input",
        "Verify skill parses all 7 issues with correct severity and category",
        "Verify skill identifies the weighted score and grade"
      ],
      "pass_criteria": "All issues extracted. No issue lost or duplicated.",
      "fail_indicators": []
    },
    {
      "id": "fix-in-severity-order",
      "name": "Fix in Severity Order",
      "prompt": "Run auth-fix and observe fix application order",
      "setup": "Scorecard contains CRITICAL (no CSRF validation on POST), HIGH (missing cookie security flags), MEDIUM (no audit logging).",
      "input_files": [],
      "expectations": [
        "Run auth-fix",
        "Observe fix application order"
      ],
      "pass_criteria": "CSRF fix applied first (CRITICAL), then cookie flags (HIGH, Session Management 15% weight), then audit logging (MEDIUM). No MEDIUM fix applied before all HIGH items resolved.",
      "fail_indicators": []
    },
    {
      "id": "fix-references-correct-pattern",
      "name": "Fix References Correct Pattern",
      "prompt": "Run auth-fix and check which reference file the skill loads",
      "setup": "Issue in \"Session Management\" category scored 4/10.",
      "input_files": [],
      "expectations": [
        "Run auth-fix",
        "Check which reference file the skill loads"
      ],
      "pass_criteria": "Skill loads `references/fix-patterns/sessions-passwords.md` and applies the \"Cookie Security Flags\" pattern. Fix modifies Better Auth config with `useSecureCookies` and `defaultCookieSameSite`.",
      "fail_indicators": []
    },
    {
      "id": "verification-step-confirms-fix",
      "name": "Verification Step Confirms Fix",
      "prompt": "Run auth-fix to apply the Origin Validation in Proxy fix and verify it works",
      "setup": "Apply the \"Origin Validation in Proxy\" fix from `csrf-headers.md`.",
      "input_files": [],
      "expectations": [
        "Run auth-fix to apply the fix",
        "Check that skill verifies: code compiles, Better Auth config valid, auth flow not broken"
      ],
      "pass_criteria": "Skill confirms `validateOrigin()` function added to proxy.ts. Reports verification result before moving to next fix.",
      "fail_indicators": []
    },
    {
      "id": "re-score-shows-improvement",
      "name": "Re-Score Shows Improvement",
      "prompt": "Run auth-fix through full cycle and compare before/after scores",
      "setup": "Initial score 58/100 (grade C). Apply fixes for 2 CRITICAL + 3 HIGH issues.",
      "input_files": [],
      "expectations": [
        "Run auth-fix through full cycle",
        "Compare before/after scores per category"
      ],
      "pass_criteria": "Re-score produces a higher weighted score. Each fixed category shows improvement. Final grade is at least B+. Report uses `assets/templates/fix-report.md.template` format.",
      "fail_indicators": []
    }
  ]
}
