{
  "skill": "security-fix",
  "eval_name": "eval-fix-workflow",
  "description": "Verify the security-fix skill correctly parses scoring output, prioritizes, fixes, and re-scores.",
  "tests": [
    {
      "id": "accept-scoring-input",
      "name": "Accept Scoring Input",
      "prompt": "Run security-fix with the scorecard as input",
      "setup": "Provide a security-scoring scorecard with 8 issues across Input Validation, CSP, Webhooks, Monitoring.",
      "input_files": [],
      "expectations": [
        "Run security-fix with the scorecard as input",
        "Verify skill parses all 8 issues with correct severity and category",
        "Verify skill identifies the weighted score and grade"
      ],
      "pass_criteria": "All issues extracted. No issue lost or duplicated.",
      "fail_indicators": []
    },
    {
      "id": "fix-in-severity-order",
      "name": "Fix in Severity Order",
      "prompt": "Run security-fix and observe fix application order",
      "setup": "Scorecard contains CRITICAL (no input validation on API routes), HIGH (missing CSP headers), MEDIUM (no request IDs in logs).",
      "input_files": [],
      "expectations": [
        "Run security-fix",
        "Observe fix application order"
      ],
      "pass_criteria": "Input validation fixed first (CRITICAL), then CSP headers (HIGH, CSP 12% weight), then request IDs (MEDIUM). No MEDIUM fix applied before all HIGH items resolved.",
      "fail_indicators": []
    },
    {
      "id": "fix-references-correct-pattern",
      "name": "Fix References Correct Pattern",
      "prompt": "Run security-fix and check which reference file the skill loads",
      "setup": "Issue in \"Input Validation\" category scored 3/10.",
      "input_files": [],
      "expectations": [
        "Run security-fix",
        "Check which reference file the skill loads"
      ],
      "pass_criteria": "Skill loads `references/fix-patterns/input-secrets.md` and applies the \"Add Zod Validation to API Route\" pattern. Fix adds `schema.safeParse(body)` with `.strict()` to route handlers.",
      "fail_indicators": []
    },
    {
      "id": "verification-step-confirms-fix",
      "name": "Verification Step Confirms Fix",
      "prompt": "Run security-fix to apply the CSP Directives fix and verify headers are correct",
      "setup": "Apply the \"CSP Directives\" fix from `csp-data.md`.",
      "input_files": [],
      "expectations": [
        "Run security-fix to apply the fix",
        "Check that skill verifies: CSP header present on responses, no unsafe-eval in script-src, frame-ancestors set to 'none'"
      ],
      "pass_criteria": "Skill confirms Content-Security-Policy header added to proxy. Reports verification result before moving to next fix.",
      "fail_indicators": []
    },
    {
      "id": "re-score-shows-improvement",
      "name": "Re-Score Shows Improvement",
      "prompt": "Run security-fix through full cycle and compare before/after scores",
      "setup": "Initial score 48/100 (grade D+). Apply fixes for 3 CRITICAL + 3 HIGH issues.",
      "input_files": [],
      "expectations": [
        "Run security-fix through full cycle",
        "Compare before/after scores per category"
      ],
      "pass_criteria": "Re-score produces a higher weighted score. Each fixed category shows improvement. Final grade is at least B+. Report uses `assets/templates/fix-report.md.template` format.",
      "fail_indicators": []
    }
  ]
}
